,brandnm,goodsnm,4days,7days
416,"DIANE VON FURSTENBERG,CELINE","chic leather jeans black ,belt velvet jacket",43000,63000
417,BURBERRY,button check pattern slacks grey,24000,34000
418,ALEXANDER MCQUEEN,pocket basic pattern jacket charcoal,39000,49000
419,"CHRISTIAN DIOR,CHRISTIAN DIOR","pin stripe vintage jacket,pin stripe skirt",38000,58000
420,SAINT LAURENT,pocket basic pattern doublebreasted-coat black,39000,49000
421,CHRISTIAN DIOR,pleats basic pattern wool wide-pants charcoal,24000,34000
422,FENDI,stitch basic pattern tank top bra-top white,24000,34000
423,PRADA,button basic pattern wool jacket black,39000,49000
424,CHLOE,button pointed sweater cream,19000,29000
425,SACAI,basic pattern wool sweater black,24000,34000
426,BURBERRY,button check pattern shirts brown,24000,34000
427,DOLCE & GABBANA,pocket basic pattern jacket beige,39000,49000
428,GIVENCHY,pleats basic pattern pleats-skirt black,24000,34000
429,AKRIS,button basic pattern singlebreasted-coat red,39000,49000
430,SORRY TOO MUCH LOVE,button dots pattern A-Line dress navy,34000,44000
431,RENEEVON,geometric pattern A-Line dress,29000,39000
432,CELINE,round hem line sweater gray_1,19000,29000
433,DOLCE & GABBANA,button stripe pattern jacket navy,39000,49000
434,BURBERRY,pocket check pattern cape,39000,49000
435,HUGO BOSS,button basic pattern coat charcoal,39000,49000
436,PRADA,pocket basic pattern zipup-jumper black,39000,49000
437,PRADA,pocket basic pattern windbreaker white,39000,49000
438,BURBERRY,basic pattern cashmere top mint,24000,34000
439,CELINE,drop shoulder boxy coat,34000,44000
440,GUCCI,embroidery basic pattern t-shirts black,29000,39000
441,CHRISTIAN DIOR,button check pattern A-Line shirt-dress black,39000,49000
442,ETRO,button paisley print pattern blouse multi,19000,29000
443,"BURBERRY,BURBERRY","button basic pattern jacket ivory,button basic pattern skirt ivory",48000,68000
444,YVES SAINT LAURENT,check pattern wool sweater black,19000,29000
445,GUCCI,side shirring knit,19000,29000
446,MAISON MARGIELA,basic pattern t-shirts white,19000,29000
447,PRADA,pocket basic pattern jumper black,39000,49000
448,ETRO,basic pattern wool skirt black,24000,34000
449,ETRO,basic pattern top beige,24000,34000
450,MAX MARA,graphics pattern A-Line dress black,34000,44000
451,SORRY TOO MUCH LOVE,button basic pattern shirts white,19000,29000
452,DOLCE & GABBANA,pocket basic pattern pants navy,24000,34000
453,LOUIS VUITTON,lace basic pattern t-shirts black,24000,34000
454,CHRISTIAN DIOR,pocket graphics pattern skirt multi,19000,29000
455,GUCCI,pocket basic pattern slacks ivory,24000,34000
456,CHANEL,yoke detail flare skirt,19000,29000
457,CHLOE,high waist leopard skirt multi,19000,29000
458,AMSALE,one shoulder midi dress violet,34000,44000
459,ETRO,paisley print pattern H-Line dress brown,34000,44000
460,SORRY TOO MUCH LOVE,gather flower pattern A-Line dress pink,34000,44000
461,MAX MARA,belt jacquard pattern coat grey,39000,49000
462,AMSALE,tube top shirring one shoulder dress,34000,44000
463,AMSALE,tube top chiffon dress ivory,39000,49000
464,SORRY TOO MUCH LOVE,button basic pattern blouse pink,19000,29000
465,VERSACE,unbalance printing blouse black,19000,29000
466,PRADA,collar point long coat multi,34000,44000
467,"BRUNELLO CUCINELLI,ADAM LIPPES","button point jeans lavender,round neck knit",38000,58000
468,HUGO BOSS,button basic pattern wool singlebreasted-jacket charcoal,39000,49000
469,SORRY TOO MUCH LOVE,flower pattern A-Line linen dress red,29000,39000
470,BURBERRY,pleats check pattern wool skirt green,24000,34000
471,CHLOE,basic pattern skirt navy,24000,34000
472,SAINT LAURENT,stud slit denim skirt blue,24000,34000
473,SORRY TOO MUCH LOVE,ruffle paisley print pattern A-Line dress grey,29000,39000
474,"JIL SANDER,SJSJ","printing sweat shirt ,fringe detail skirt",39000,59000
475,ESCADA,belt point trench coat green,34000,44000
476,VERSACE,geometric pattern skirt purple,24000,34000
477,LOUIS VUITTON,panel midi skirt black,19000,29000
478,MIU MIU,hoodie basic pattern padding-outer purple,39000,49000
479,CHLOE,pocket stripe pattern pants grey,24000,34000
480,MAX MARA,button basic pattern singlebreasted-jacket black,39000,49000
481,AMSALE,off shoulder maxi dress lavender,34000,44000
482,MIU MIU,zig zag pattern cardigan multi,34000,44000
483,VALENTINO,basic pattern A-Line dress black,39000,49000
484,HUGO BOSS,basic pattern sweater purple,24000,34000
485,BURBERRY,button check pattern shirts charcoal,24000,34000
486,HERMES,none collar single button jacket,34000,44000
487,BURBERRY,check pattern straight skirt,19000,29000
488,JIL SANDER,modern mood high neck jacket,34000,44000
489,CHRISTIAN DIOR,pocket check pattern wool skirt black,19000,29000
490,YVES SAINT LAURENT,button basic pattern H-Line dress orange,34000,44000
491,SALVATORE FERRAGAMO,basic pattern sweater red,19000,29000
492,SORRY TOO MUCH LOVE,button basic pattern blouse cream,19000,29000
493,PRADA,pleats graphics pattern pleats-skirt pink,24000,34000
494,BURBERRY,printing lettering pattern singlebreasted-coat beige,39000,49000
495,SORRY TOO MUCH LOVE,button basic pattern blouse beige,15000,25000
496,YVES SAINT LAURENT,check pattern wool sweater brown,24000,34000
497,BURBERRY,pleats detail kilt skirts black,19000,29000
498,MAX MARA,gather flower pattern A-Line dress mustard,39000,49000
499,ETRO,button paisley print pattern shirts hotpink,24000,34000
500,MAX MARA,button basic pattern linen shirts red,24000,34000
501,MAX MARA,slit basic pattern wrap-skirt beige,24000,34000
502,ETRO,basic pattern wool skirt burgundy,29000,39000
503,VALENTINO,button basic pattern jacket grey,34000,44000
504,GUCCI,button basic pattern jacket pink,39000,49000
505,GIVENCHY,button basic pattern wool blazer black,39000,49000
506,BURBERRY,pocket basic pattern wool duffle-coat green,39000,49000
507,BURBERRY,button basic pattern polo-shirts black,24000,34000
508,LANVIN,flower pattern back zipper skirt,24000,34000
509,YVES SAINT LAURENT,basic pattern jacket green,39000,49000
510,CHLOE,pleats basic pattern pleats-skirt black,19000,29000
511,VIVIENNE WESTWOOD,check pattern ribbon detail shirts,34000,44000
512,JIL SANDER,basic pattern cashmere sweater violet,19000,29000
513,HUGO BOSS,button check pattern shirts deeppink,29000,39000
514,BALMAIN,printing pattern sweat-shirts black,24000,34000
515,ESCADA,button color block pattern jacket blue,39000,49000
516,DOLCE & GABBANA,flower pattern slim line dress,39000,49000
517,MAX MARA,pleats stripe pattern skirt grey,19000,29000
518,SORRY TOO MUCH LOVE,lace basic pattern blouse black,29000,39000
519,CHLOE,basic pattern turtle neck turtleneck beige,24000,34000
520,ESCADA,check pattern wool skirt blue,24000,34000
521,"JIL SANDER,JIL SANDER","simple three button jacket wine,modern design pants wine",48000,68000
522,DOLCE & GABBANA,printing pattern t-shirts charcoal,19000,29000
523,PRADA,ruffle ribbon dress black,34000,44000
524,CHANEL,button basic pattern singlebreasted-jacket grey,34000,44000
525,DOLCE & GABBANA,printing pattern t-shirts grey,24000,34000
526,BURBERRY,button basic pattern blazer charcoal,39000,49000
527,MIU MIU,pin-tuck sleeve v-neck dress pink,39000,49000
528,SALVATORE FERRAGAMO,button dots pattern shirts ivory,24000,34000
529,MAX MARA,flower pattern flared-skirt brown,24000,34000
530,THOM BROWNE,shirts dress,34000,44000
531,AMSALE,floral shoulder dress ivory,39000,49000
532,"SYZ,VALENTINO","silky cuffs floral blouse ,silk shirring draped skirt",39000,59000
533,STONE ISLAND,hoodie basic pattern windbreaker blue,39000,49000
534,BURBERRY,belt basic pattern padding-outer black,39000,49000
535,CHANEL,button color block pattern cashmere vest,24000,34000
536,YVES SAINT LAURENT,ruffle stripe pattern blouse multi,24000,34000
537,ESCADA,pocket basic pattern jacket navy,39000,49000
538,THOM BROWNE,fringe detail check pattern coat,34000,44000
539,PRADA,color fur detail coat black,34000,44000
540,BURBERRY,basic pattern cape white,39000,49000
541,AMSALE,tube banding dress white,39000,49000
542,MAX MARA,draping detail raglan sleeve dress,34000,44000
543,YVES SAINT LAURENT,pocket basic pattern H-Line wool dress black,34000,44000
544,GIVENCHY,stripe pattern wool slacks black,24000,34000
545,MAX MARA,tweed pattern skirt grey,24000,34000
546,"SONIA RYKIEL,CHRISTIAN DIOR","sqaure neck knit top black,vintage knitted skirt",43000,63000
547,AMSALE,v neck ruffle sleeve purple,34000,44000
548,"O'2ND,CELINE","decorated front raglan blouse,basic wool slacks",39000,59000
549,"CHANEL,CHANEL","button tweed pattern doublebreasted-coat multi,tweed pattern skirt multi",48000,68000
550,YVES SAINT LAURENT,stripe pattern H-Line wool knit-dress green,34000,44000
551,BURBERRY,embroidery basic pattern t-shirts charcoal,24000,34000
552,BURBERRY,check pattern skirt green,24000,34000
553,PRADA,gather basic pattern A-Line dress black,39000,49000
554,GUCCI,basic jacket black,34000,44000
555,"MAX MARA,ISABEL MARANT ETOILE","a line check skirt ,punching combed knit",39000,59000
556,PRADA,fur detail slim line single coat,34000,44000
557,BURBERRY,check piping detail cardigan red,39000,49000
558,"CHRISTIAN DIOR,CHRISTIAN DIOR","button check pattern jacket grey,check pattern skirt grey",48000,68000
559,YVES SAINT LAURENT,stripe pattern wool sweater charcoal,19000,29000
560,SORRY TOO MUCH LOVE,gather basic pattern blouse pink,29000,39000
561,MAX MARA,slit graphics pattern H-Line dress beige,39000,49000
562,ETRO,button paisley print pattern shirts skyblue,19000,29000
563,"MINE,BRUNELLO CUCINELLI","stripe fur top,classic slacks",34000,54000
564,VERSACE,unique pattern flare skirt,24000,34000
565,MIU MIU,punching basic pattern t-shirts white,19000,29000
566,CHRISTIAN DIOR,button basic pattern doublebreasted-coat navy,39000,49000
567,"CELINE,CELINE","ribbon tie knit,h line skirt",48000,68000
568,"CELINE,THE CLOZET","check tennis skirt ,v neck cardigan",39000,59000
569,MIU MIU,raglan dress jacket black,34000,44000
570,CHANEL,basic pattern 3depth navy,34000,44000
571,PRADA,pleats basic pattern H-Line dress black,34000,44000
572,ESCADA,basic pattern H-Line dress black,39000,49000
573,JIL SANDER,low v neck dress bluegreen,39000,49000
574,PRADA,unique pattern sweater multi,19000,29000
575,BURBERRY,pleats check pattern wool pleats-skirt khaki,24000,34000
576,BURBERRY,basic pattern cape white,39000,49000
577,AMSALE,tube banding dress white,39000,49000
578,MAX MARA,draping detail raglan sleeve dress,34000,44000
579,YVES SAINT LAURENT,pocket basic pattern H-Line wool dress black,34000,44000
580,GIVENCHY,stripe pattern wool slacks black,24000,34000
581,MAX MARA,tweed pattern skirt grey,24000,34000
582,"SONIA RYKIEL,CHRISTIAN DIOR","sqaure neck knit top black,vintage knitted skirt",43000,63000
583,AMSALE,v neck ruffle sleeve purple,34000,44000
584,"O'2ND,CELINE","decorated front raglan blouse,basic wool slacks",39000,59000
585,"CHANEL,CHANEL","button tweed pattern doublebreasted-coat multi,tweed pattern skirt multi",48000,68000
586,YVES SAINT LAURENT,stripe pattern H-Line wool knit-dress green,34000,44000
587,BURBERRY,embroidery basic pattern t-shirts charcoal,24000,34000
588,BURBERRY,check pattern skirt green,24000,34000
589,PRADA,gather basic pattern A-Line dress black,39000,49000
590,GUCCI,basic jacket black,34000,44000
591,"MAX MARA,ISABEL MARANT ETOILE","a line check skirt ,punching combed knit",39000,59000
592,PRADA,fur detail slim line single coat,34000,44000
593,BURBERRY,check piping detail cardigan red,39000,49000
594,"CHRISTIAN DIOR,CHRISTIAN DIOR","button check pattern jacket grey,check pattern skirt grey",48000,68000
595,YVES SAINT LAURENT,stripe pattern wool sweater charcoal,19000,29000
596,SORRY TOO MUCH LOVE,gather basic pattern blouse pink,29000,39000
597,MAX MARA,slit graphics pattern H-Line dress beige,39000,49000
598,ETRO,button paisley print pattern shirts skyblue,19000,29000
599,"MINE,BRUNELLO CUCINELLI","stripe fur top,classic slacks",34000,54000
600,VERSACE,unique pattern flare skirt,24000,34000
601,MIU MIU,punching basic pattern t-shirts white,19000,29000
602,CHRISTIAN DIOR,button basic pattern doublebreasted-coat navy,39000,49000
603,"CELINE,CELINE","ribbon tie knit,h line skirt",48000,68000
604,"CELINE,THE CLOZET","check tennis skirt ,v neck cardigan",39000,59000
605,MIU MIU,raglan dress jacket black,34000,44000
606,CHANEL,basic pattern 3depth navy,34000,44000
607,PRADA,pleats basic pattern H-Line dress black,34000,44000
608,ESCADA,basic pattern H-Line dress black,39000,49000
609,JIL SANDER,low v neck dress bluegreen,39000,49000
610,PRADA,unique pattern sweater multi,19000,29000
611,BURBERRY,pleats check pattern wool pleats-skirt khaki,24000,34000
612,"CHRISTIAN WIJNANTS,GUCCI","color combed knit skirt ,extension sleeve turtle knit",43000,63000
613,MIU MIU,basic pattern H-Line dress red,39000,49000
614,ISSEY MIYAKE,button basic pattern shirts white,24000,34000
615,FENDI,pleats check pattern skirt skyblue,24000,34000
616,CARTIER,basic pattern H-Line dress black,39000,49000
617,GUCCI,basic pattern turtle neck turtleneck navy,24000,34000
618,ALEXANDER MCQUEEN,printing pattern t-shirts black,24000,34000
619,MIU MIU,vintage mood slim collar coat,34000,44000
620,"DOLCE & GABBANA,DOLCE & GABBANA","single button long linen jacket,basic line linen pants beige",48000,68000
621,VERSACE,button basic pattern jeans black,24000,34000
622,DOLCE & GABBANA,basic pattern boat neck tube-top black,24000,34000
623,MAX MARA,button basic pattern blazer black,39000,49000
624,JIL SANDER,minimal pocket jacket,34000,44000
625,HUGO BOSS,basic pattern t-shirts navy,24000,34000
626,LANVIN,banding point jumper skyblue,34000,44000
627,PRADA,fur texture sleeveless cardigan,34000,44000
628,CELINE,slit detail pocket detail knit dress,34000,44000
629,DOLCE & GABBANA,leopard print pattern tank top tank-top brown,19000,29000
630,DIOR,basic pattern wool skirt black,24000,34000
631,"EMPORIO ARMANI,PAULE KA","see-through armpit shirring knit,round printing skirt",38000,58000
632,"SANDRO,SALVATORE FERRAGAMO","unique pattern blouse,flare skirt beifge",39000,59000
633,AMSALE,low v-neck trumpet dress white,34000,44000
634,MIU MIU,embroidery lettering pattern t-shirts black,24000,34000
635,BURBERRY,button check pattern shirts multi,24000,34000
636,CHLOE,white color pointed single coat,34000,44000
637,JIL SANDER,cutout basic pattern H-Line dress black,34000,44000
638,PRADA,frill basic pattern t-shirts black,24000,34000
639,PRADA,ruffle detail long coat,34000,44000
640,DOLCE & GABBANA,slime line single coat black,34000,44000
641,PRADA,slit basic pattern silk skirt blue,19000,29000
642,HUGO BOSS,basic pattern unbalance skirt navy,24000,34000
643,CHLOE,wide collar jacket gray,34000,44000
644,SACAI,lined lace jacket blouse ivory,24000,34000
645,ESCADA,princess line single coat brown,34000,44000
646,DOLCE & GABBANA,flower pattern top brown,19000,29000
647,ESCADA,basic pattern jacket purple,39000,49000
648,PRADA,basic pattern t-shirts black,24000,34000
649,MAX MARA,basic pattern skirt navy,24000,34000
650,"GIVENCHY,THEORY","peplum boots cut slacks,modern oxford shirt",43000,63000
651,MAX MARA,fur texture one button coat,34000,44000
652,DOLCE & GABBANA,check pattern long sleeve bustier,24000,34000
653,BURBERRY,zipper detail pointed jacket beige,34000,44000
654,YVES SAINT LAURENT,pocket basic pattern linen skirt pink,19000,29000
655,YVES SAINT LAURENT,slit jacquard pattern skirt bluegreen,19000,29000
656,BURBERRY,button basic pattern cardigan green,39000,49000
657,BURBERRY,shawl collar double coat,34000,44000
658,SACAI,stripe pattern sweat-shirts navy,24000,34000
659,BURBERRY LONDON,pocket check pattern skirt beige,19000,29000
660,"EMPORIO ARMANI,EMPORIO ARMANI","seethrough blouse,pattern skirt",43000,63000
661,AMSALE,one shoulder midi dress charcoal,34000,44000
662,BURBERRY,classic trench coat beige,34000,44000
663,BURBERRY,double button point coat pink,34000,44000
664,PRADA,slim silhouette single button coat,34000,44000
665,MAX MARA,simple design trench coat,34000,44000
666,MAX MARA,front zipper patterned fur coat,34000,44000
667,"ETRO,ETRO","paisley print pattern top multi,gather paisley print pattern skirt multi",48000,68000
668,PRADA,pocket basic pattern wool coat black,39000,49000
669,ISSEY MIYAKE,button basic pattern shirts brown,24000,34000
670,DOLCE & GABBANA,button basic pattern wool slacks black,24000,34000
671,CHLOE,button basic pattern coat black,39000,49000
672,SAINT LAURENT,button basic pattern shirts blue,24000,34000
673,"ALEXANDER MCQUEEN,LANVIN","pearl sleeve blouse ivory,flare skirt deep khaki",38000,58000
674,YVES SAINT LAURENT,basic pattern wool sweater bluegreen,19000,29000
675,DOLCE & GABBANA,basic pattern denim-jacket blue,34000,44000
676,MAX MARA,gather basic pattern A-Line dress blue,34000,44000
677,MIU MIU,basic pattern flared-skirt gold,24000,34000
678,BURBERRY,embroidery basic pattern mermaid denim-skirt blue,24000,34000
679,ISSEY MIYAKE,button basic pattern shirts yellow,24000,34000
680,MAX MARA,string belted padding jumper pink,34000,44000
681,FENDI,pocket basic pattern sweat-pants beige,19000,29000
682,BURBERRY,button basic pattern A-Line dress black,34000,44000
683,DOLCE & GABBANA,basic pattern top black,24000,34000
684,CHLOE,roll up basic pattern slacks charcoal,24000,34000
685,HUGO BOSS,slim half coat black,34000,44000
686,CHRISTIAN DIOR,button detail skirt black,19000,29000
687,DIOR,button basic pattern jacket black,39000,49000
688,YVES SAINT LAURENT,slit basic pattern skirt mustard,24000,34000
689,ISSEY MIYAKE,basic pattern skirt brown,24000,34000
690,BURBERRY,ribbon basic pattern A-Line dress black,39000,49000
691,"YCH,FENDI","feminine military blouse,high waist wide slacks",36000,56000
692,"BALMAIN,TIME","shoulder button pullover ,burnout flare skirt",39000,59000
693,BURBERRY,unique pattern wrap skirt multi,24000,34000
694,VALENTINO,layered detail trench coat beige,34000,44000
695,ISSEY MIYAKE,pocket basic pattern pants black,24000,34000
696,MAX MARA,belt basic pattern wool coat brown,39000,49000
697,DIOR,pocket basic pattern t-shirts cream,19000,29000
698,LOUIS VUITTON,pocket basic pattern blouson burgundy,39000,49000
699,ESCADA,stripe pattern slacks grey,24000,34000
700,"JIL SANDER,OBZEE","basic cotton shirt,spangles H-line middle skirt",39000,59000
701,AMSALE,shirring sleeveless dress purple,34000,44000
702,MAX MARA,strap basic pattern wool wrap-coat brown,39000,49000
703,GIVENCHY,flower pattern H-Line dress multi,39000,49000
704,CELINE,patterned midi skirt multi,19000,29000
705,HUGO BOSS,strap basic pattern coat burgundy,34000,44000
706,BURBERRY,basic pattern sweater beige,24000,34000
707,"ISSEY MIYAKE,ISSEY MIYAKE","pleats jacket black,pleats sleeveless dress black",58000,78000
708,"YVES SAINT LAURENT,YVES SAINT LAURENT","double button stripe pattern jacket,stripe pattern midi skirt multi",48000,68000
709,"ISSEY MIYAKE,ISSEY MIYAKE","pleats check pattern jacket multi,pleats check pattern unbalance skirt multi",48000,68000
710,VALENTINO,button basic pattern jacket red,34000,44000
711,MAX MARA,button color block pattern coat black,39000,49000
712,YVES SAINT LAURENT,pocket basic pattern wool slacks brown,24000,34000
713,MAX MARA,graphics pattern skirt black,24000,34000
714,"HUGO BOSS,HUGO BOSS","tailored jacket black,pencil skirt black",48000,68000
715,"ALEXANDER WANG,ALEXANDER MCQUEEN","knit jogger pants ,fringe turtle knit",43000,63000
716,DOLCE & GABBANA,button basic pattern jacket charcoal,34000,44000
717,BALMAIN,button basic pattern leather-jacket beige,34000,44000
718,YVES SAINT LAURENT,button basic pattern wool coat black,39000,49000
719,BURBERRY,basic pattern tank-top khaki,24000,34000
720,PRADA,high neck crop jumper blue,39000,49000
721,MAISON MARGIELA,button stripe pattern shirts blue,24000,34000
722,CHLOE,basic pattern mermaid skirt brown,24000,34000
723,SALVATORE FERRAGAMO,basic pattern skirt black,24000,34000
724,MAX MARA,gather basic pattern A-Line dress black,39000,49000
725,VERSACE,basic pattern knit-vest black,24000,34000
726,AMSALE,halter neck frill maxi dress pink,34000,44000
727,GUCCI,leather belt detail coat black,34000,44000
728,SACAI,layered detail cardigan multi,19000,29000
729,YVES SAINT LAURENT,basic pattern wool skirt black,19000,29000
730,BURBERRY,pocket basic pattern balmacaan-jacket navy,34000,44000
731,DOLCE & GABBANA,pocket stripe pattern wool slacks brown,24000,34000
732,PRADA,button check pattern wool singlebreasted-jacket brown,39000,49000
733,"PRADA,EL ESTILO DE CLAIRE","frill cardigan,color block pleats long skirt",36000,56000
734,AMSALE,off shoulder shirring dress white,34000,44000
735,CHLOE,raglan coat black,34000,44000
736,"PRADA,HUGO BOSS","waist pintuck pattern shirts skyblue ,cotton slacks navy",48000,68000
737,PRADA,single button modern coat black,34000,44000
738,VERSACE,button jacquard pattern blazer black,39000,49000
739,LANVIN,button basic pattern slacks charcoal,24000,34000
740,LANVIN,embroidery flower pattern bolero navy,39000,49000
741,ETRO,button geometric pattern shirts multi,24000,34000
742,PRADA,zipper detail cape padding jumper,34000,44000
743,VALENTINO,button stripe pattern wool singlebreasted-jacket green,34000,44000
744,BURBERRY,basic pattern slacks red,24000,34000
745,DOLCE & GABBANA,lace detail tweed jacket ivory,39000,49000
746,YVES SAINT LAURENT,button basic pattern wool coat grey,39000,49000
747,GIVENCHY,button check pattern wool jacket,34000,44000
748,PRADA,front button check pattern jacket,34000,44000
749,PRADA,big pocket single breasted coat black,34000,44000
750,GIVENCHY,basic pattern H-Line wrap-dress black,39000,49000
751,CELINE,basic pattern skirt beige,24000,34000
752,BURBERRY,button basic pattern jacket black,39000,49000
753,"MIU MIU,MIU MIU","stripe sleeveless top,stripe short pants",48000,68000
754,"& OTHER STORIES,DOLCE & GABBANA","high neck lace blouse,bustier dress black",39000,59000
755,CHLOE,side ribbon pocket point jacket,34000,44000
756,PRADA,high neck crop jumper blue,39000,49000
757,MAISON MARGIELA,button stripe pattern shirts blue,24000,34000
758,CHLOE,basic pattern mermaid skirt brown,24000,34000
759,SALVATORE FERRAGAMO,basic pattern skirt black,24000,34000
760,MAX MARA,gather basic pattern A-Line dress black,39000,49000
761,VERSACE,basic pattern knit-vest black,24000,34000
762,AMSALE,halter neck frill maxi dress pink,34000,44000
763,GUCCI,leather belt detail coat black,34000,44000
764,SACAI,layered detail cardigan multi,19000,29000
765,YVES SAINT LAURENT,basic pattern wool skirt black,19000,29000
766,BURBERRY,pocket basic pattern balmacaan-jacket navy,34000,44000
767,DOLCE & GABBANA,pocket stripe pattern wool slacks brown,24000,34000
768,PRADA,button check pattern wool singlebreasted-jacket brown,39000,49000
769,"PRADA,EL ESTILO DE CLAIRE","frill cardigan,color block pleats long skirt",36000,56000
770,AMSALE,off shoulder shirring dress white,34000,44000
771,CHLOE,raglan coat black,34000,44000
772,"PRADA,HUGO BOSS","waist pintuck pattern shirts skyblue ,cotton slacks navy",48000,68000
773,PRADA,single button modern coat black,34000,44000
774,VERSACE,button jacquard pattern blazer black,39000,49000
775,LANVIN,button basic pattern slacks charcoal,24000,34000
776,LANVIN,embroidery flower pattern bolero navy,39000,49000
777,ETRO,button geometric pattern shirts multi,24000,34000
778,PRADA,zipper detail cape padding jumper,34000,44000
779,VALENTINO,button stripe pattern wool singlebreasted-jacket green,34000,44000
780,BURBERRY,basic pattern slacks red,24000,34000
781,DOLCE & GABBANA,lace detail tweed jacket ivory,39000,49000
782,YVES SAINT LAURENT,button basic pattern wool coat grey,39000,49000
783,GIVENCHY,button check pattern wool jacket,34000,44000
784,PRADA,front button check pattern jacket,34000,44000
785,PRADA,big pocket single breasted coat black,34000,44000
786,GIVENCHY,basic pattern H-Line wrap-dress black,39000,49000
787,CELINE,basic pattern skirt beige,24000,34000
788,BURBERRY,button basic pattern jacket black,39000,49000
789,"MIU MIU,MIU MIU","stripe sleeveless top,stripe short pants",48000,68000
790,"& OTHER STORIES,DOLCE & GABBANA","high neck lace blouse,bustier dress black",39000,59000
791,CHLOE,side ribbon pocket point jacket,34000,44000
792,CELINE,diagonal cutting line long coat,34000,44000
793,THOM BROWNE,white pointed pleats skirt,19000,29000
794,DOLCE & GABBANA,graphics pattern top charcoal,19000,29000
795,HUGO BOSS,button basic pattern A-Line pique-dress khaki,39000,49000
796,MAX MARA,basic pattern coat,39000,49000
797,SACAI,button stripe pattern shirts blue,24000,34000
798,HUGO BOSS,stitch pointed coat pink,34000,44000
799,"DIANE VON FURSTENBERG,PRADA","two pocket skirt brown,turtle neck knit black",38000,58000
800,CHRISTIAN DIOR,button check pattern wool singlebreasted-jacket green,34000,44000
801,BURBERRY,pleats check pattern wool skirt grey,24000,34000
802,JIL SANDER,pocket basic pattern doublebreasted-jacket black,39000,49000
803,HUGO BOSS,basic pattern H-Line dress grey,39000,49000
804,AMSALE,ribbon detail tube top dress,39000,49000
805,"CARVEN,CHLOE","lace blouse white,ribbon pleats skirt",43000,63000
806,JIL SANDER,wrap design jacket black,34000,44000
807,DOLCE & GABBANA,peter pan collar coat black,34000,44000
808,FENDI,punching dots pattern top orange,19000,29000
809,PRADA,basic pattern denim-jacket blue,34000,44000
810,CHRISTIAN DIOR,button color block pattern sweater ivory,24000,34000
811,HUGO BOSS,check pattern H-Line dress ivory,39000,49000
812,YVES SAINT LAURENT,suede blouson mustard,34000,44000
813,ALEXANDER MCQUEEN,belted short jacket cream 1,34000,44000
814,"LANVIN,OBZEE","front gather shorts,knit collar shimmer blouse",39000,59000
815,DOLCE & GABBANA,lace detail leopard blouse,19000,29000
816,MAX MARA,tweed mini skirt multi,19000,29000
817,SORRY TOO MUCH LOVE,ruffle basic pattern blouse black,29000,39000
818,HUGO BOSS,punching basic pattern skirt brown,24000,34000
819,TOM FORD,taping detail slit tight skirt,24000,34000
820,YVES SAINT LAURENT,shoulder point double coat,34000,44000
821,MAX MARA,square neck cap sleeve t-shirts,19000,29000
822,ETRO,gather graphics pattern H-Line dress brown,34000,44000
