,brandnm,goodsnm,4days,7days
823,MAX MARA,dots pattern turtle neck turtleneck grey,24000,34000
824,SACAI,color block pattern turtle neck sweater navy,24000,34000
825,DOLCE & GABBANA,button jacquard pattern jacket brown,39000,49000
826,"MAX MARA,BARRIE","chain point denim jean,animal pattern knit top",43000,63000
827,"SALVATORE FERRAGAMO,MAX MARA","sleeveless knit top brown,simple skirt black",48000,68000
828,PRADA,pocket detail single coat gray,34000,44000
829,LANVIN,stitch basic pattern jeans black,19000,29000
830,SALVATORE FERRAGAMO,basic pattern A-Line knit-dress black,39000,49000
831,SORRY TOO MUCH LOVE,button basic pattern blouse white,29000,39000
832,MAX MARA,button basic pattern jacket black,39000,49000
833,DOLCE & GABBANA,pocket basic pattern skirt black,24000,34000
834,"YMC,PRADA","lovely twist knit navy ,waffle knit skirt",39000,59000
835,"EL ESTILO DE CLAIRE,HERMES PETITE H","ruffle off-shoulder stripe blouse,floral pattern silk skirt",39000,59000
836,BALMAIN,double button long coat white,34000,44000
837,ALEXANDER MCQUEEN,button basic pattern jacket beige,34000,44000
838,PRADA,pocket basic pattern A-Line dress navy,34000,44000
839,SORRY TOO MUCH LOVE,basic pattern mermaid skirt blue,29000,39000
840,VALENTINO,basic pattern skirt beige,24000,34000
841,JIL SANDER,strap basic pattern coat charcoal,39000,49000
842,PRADA,button basic pattern singlebreasted-jacket navy,39000,49000
843,VALENTINO,pocket basic pattern slacks navy,24000,34000
844,YVES SAINT LAURENT,double button trench coat black,34000,44000
845,ESCADA,silver button point coat,34000,44000
846,BURBERRY,check pattern shirt multi,19000,29000
847,BURBERRY,slit basic pattern skirt brown,19000,29000
848,MAX MARA,pocket check pattern skirt black,24000,34000
849,MAX MARA,strap basic pattern wrap-coat black,39000,49000
850,GUCCI,eyelet denim dress blue,34000,44000
851,MAX MARA,shawl collar fur detail coat gray,34000,44000
852,BURBERRY,pin-tuck detail yoke skirt black,19000,29000
853,ESCADA,gather basic pattern H-Line dress blue,39000,49000
854,LOUIS VUITTON,power shoulder short jacket,34000,44000
855,CHANEL,stripe pattern pointed cardigan multi,39000,49000
856,ISSEY MIYAKE,button basic pattern blouse grey,19000,29000
857,PRADA,button basic pattern cashmere slacks navy,24000,34000
858,MAX MARA,stripe pattern skirt multi,24000,34000
859,PRADA,pocket Quilting pattern padding-outer yellow,39000,49000
860,BURBERRY,belt basic pattern trench-coat beige,39000,49000
861,MAX MARA,basic pattern skirt black,24000,34000
862,"MAX MARA,MICHAA","lettering crew knit ,high waist wool slacks",39000,59000
863,"VIVIENNE WESTWOOD,LANVIN","lettering turtle knit,high-waist straight pants",43000,63000
864,CHLOE,string ribbon blouse black,19000,29000
865,MAX MARA,fur high neck padding jumper,34000,44000
866,STONE ISLAND,basic pattern t-shirts navy,19000,29000
867,BURBERRY,button basic pattern wool singlebreasted-coat khaki,34000,44000
868,YVES SAINT LAURENT,button check pattern slacks grey,24000,34000
869,EMPORIO ARMANI,frill basic pattern t-shirts black,19000,29000
870,GUCCI,waist point slacks,19000,29000
871,CELINE,basic pattern turtle neck turtleneck pink,19000,29000
872,CHANEL,brooch check pattern jacket cream,34000,44000
873,STONE ISLAND,button basic pattern t-shirts coral,19000,29000
874,CHANEL,button basic pattern skirt black,24000,34000
875,MARNI,pintuck graphics pattern H-Line dress black,34000,44000
876,GIVENCHY,button basic pattern wool jacket black,39000,49000
877,HUGO BOSS,basic pattern skirt black,24000,34000
878,PRADA,basic pattern A-Line dress ivory,39000,49000
879,"DOLCE & GABBANA,SANCTUARY","lettering tee black,baggy cargo pants",39000,59000
880,CHRISTIAN DIOR,pleats basic pattern wool pleats-skirt brown,24000,34000
881,MAX MARA,basic pattern wool coat grey,39000,49000
882,ALEXANDER MCQUEEN,classic jacket black,34000,44000
883,AMSALE,halter neck shirring dress charcoal,34000,44000
884,JIL SANDER,stripe pattern t-shirts,19000,29000
885,ESCADA,pocket stripe pattern slacks black,24000,34000
886,MARNI,dots pattern top,19000,29000
887,MAX MARA,lace beads top,24000,34000
888,CHRISTIAN DIOR,basic pattern fur-outer black,24000,34000
889,CHLOE,pleats detail dress black,34000,44000
890,CHLOE,big lapel double-breasted coat ivory,34000,44000
891,CHRISTIAN DIOR,vintage blue coat,39000,49000
892,ETRO,floral ethnic pattern dress pink,34000,44000
893,AMSALE,spangle one shoulder dress salmon,39000,49000
894,AMSALE,string halter neck ruffle maxi dress nude,34000,44000
895,ALEXANDER MCQUEEN,shirring knit dress gray,34000,44000
896,ALEXANDER MCQUEEN,lace patch chiffon dress black,34000,44000
897,JIL SANDER,over sized double coat black,34000,44000
898,MAX MARA,suede collar check jacket brown,34000,44000
899,CHANEL,high waist wide denim jeans,19000,29000
900,VALENTINO,lace pointed collar shirt,19000,29000
901,THOM BROWNE,stripe pattern pointed cardigan,24000,34000
902,CHANEL,pocket graphics pattern zipup-jumper navy,49000,59000
903,CHLOE,basic pattern t-shirts white,19000,29000
904,GUCCI,gold belted drape dress black,34000,44000
905,THOM BROWNE,oxford basic tee gray,19000,29000
906,CHRISTIAN DIOR,ribbon draping cap sleeve dress,39000,49000
907,CHANEL,logo pointed stripe knit top,19000,29000
908,GUCCI,unbalance draping peplum check dress,34000,44000
909,THOM BROWNE,basic pattern sweat-shirts grey,24000,34000
910,FENDI,graphics pattern top,24000,34000
911,BURBERRY,embroidery basic pattern sweater ivory,24000,34000
912,CHANEL,pocket basic pattern wool cardigan grey,39000,49000
913,BURBERRY,lettering pattern t-shirts white,24000,34000
914,BALMAIN,basic pattern sweat-shirts white,24000,34000
915,BALMAIN,button basic pattern wool doublebreasted-jacket brown,39000,49000
916,MAX MARA,strap basic pattern coat pink,39000,49000
917,CHRISTIAN DIOR,button basic pattern H-Line wool dress pink,39000,49000
918,ISSEY MIYAKE,pleats basic pattern A-Line dress bluegreen,39000,49000
919,THOM BROWNE,button basic pattern t-shirts white,24000,34000
920,ISSEY MIYAKE,pleats graphics pattern unbalance dress,39000,49000
921,THOM BROWNE,stripe pattern cashmere sweater charcoal,24000,34000
922,BURBERRY,check pattern wool skirt,24000,34000
923,SORRY TOO MUCH LOVE,button dots pattern shirts brown,15000,25000
924,CHANEL,pocket graphics pattern zipup-jumper navy,49000,59000
925,CHLOE,basic pattern t-shirts white,19000,29000
926,GUCCI,gold belted drape dress black,34000,44000
927,THOM BROWNE,oxford basic tee gray,19000,29000
928,CHRISTIAN DIOR,ribbon draping cap sleeve dress,39000,49000
929,CHANEL,logo pointed stripe knit top,19000,29000
930,GUCCI,unbalance draping peplum check dress,34000,44000
931,THOM BROWNE,basic pattern sweat-shirts grey,24000,34000
932,FENDI,graphics pattern top,24000,34000
933,BURBERRY,embroidery basic pattern sweater ivory,24000,34000
934,CHANEL,pocket basic pattern wool cardigan grey,39000,49000
935,BURBERRY,lettering pattern t-shirts white,24000,34000
936,ISSEY MIYAKE,pleats stripe pattern jacket,39000,49000
937,GUCCI,printing pattern sweat-shirts grey,24000,34000
938,THOM BROWNE,button stripe pattern singlebreasted-jacket navy,39000,49000
939,LANVIN,button basic pattern wool jacket black,39000,49000
940,SACAI,punching basic pattern A-Line dress skyblue,34000,44000
941,"PRADA,EL ESTILO DE CLAIRE","sleeve cardigan set green,H-line middle leather skirt",39000,59000
942,THOM BROWNE,button stripe pattern wool cardigan black,39000,49000
943,BURBERRY,pocket check pattern skirt,24000,34000
944,CHANEL,pocket basic pattern wool fullzip-jacket grey,39000,49000
945,GUCCI,basic pattern A-Line dress cream,39000,49000
946,GUCCI,button flower pattern H-Line dress lavender,39000,49000
947,YVES SAINT LAURENT,basic pattern wool sweater black,24000,34000
948,GUCCI,pattern pointed a-line skirts,19000,29000
949,YVES SAINT LAURENT,basic pattern wool sweater red,19000,29000
950,BALENCIAGA,basic pattern t-shirts grey,19000,29000
951,CHANEL,crochet detail dress,34000,44000
952,GUCCI,mixed pattern knit top multi,24000,34000
953,MAX MARA,stripe pattern H-Line shirt-dress blue,39000,49000
954,GUCCI,button basic pattern H-Line dress grey,39000,49000
955,GIVENCHY,front zipper crop jumper black,39000,49000
956,SACAI,mixed pattern high neck blouse,19000,29000
957,GUCCI,lettering pattern sweater black,24000,34000
958,VALENTINO,lace pointed collar shirt,19000,29000
959,THOM BROWNE,stripe pattern pointed cardigan,24000,34000
960,CHANEL,pocket graphics pattern zipup-jumper navy,49000,59000
961,CHLOE,basic pattern t-shirts white,19000,29000
962,GUCCI,gold belted drape dress black,34000,44000
963,THOM BROWNE,oxford basic tee gray,19000,29000
964,CHRISTIAN DIOR,ribbon draping cap sleeve dress,39000,49000
965,CHANEL,logo pointed stripe knit top,19000,29000
966,GUCCI,unbalance draping peplum check dress,34000,44000
967,THOM BROWNE,basic pattern sweat-shirts grey,24000,34000
968,FENDI,graphics pattern top,24000,34000
969,BURBERRY,embroidery basic pattern sweater ivory,24000,34000
970,CHANEL,pocket basic pattern wool cardigan grey,39000,49000
971,BURBERRY,lettering pattern t-shirts white,24000,34000
